{
  "$schema": "https://json-schema.org/draft/2020-12/schema",
  "$id": "https://senior-pomidor.local/schemas/edge-telemetry-v2.schema.json",
  "title": "Senior Pomidor Edge Telemetry v2",
  "type": "object",
  "required": ["schema_version", "device_id", "timestamp_utc", "pods", "system_health"],
  "properties": {
    "schema_version": { "const": "senior-pomidor.edge.telemetry.v2" },
    "device_id": { "type": "string", "minLength": 1 },
    "timestamp_utc": { "$ref": "#/$defs/utcTimestamp" },
    "heartbeat_utc": { "$ref": "#/$defs/utcTimestamp" },
    "record_id": { "type": "string", "minLength": 1 },
    "boot_id": { "type": "string", "minLength": 1 },
    "sequence": { "type": "integer", "minimum": 1 },
    "stored_at_utc": { "$ref": "#/$defs/utcTimestamp" },
    "pods": {
      "type": "object",
      "required": ["pod_1", "pod_2"],
      "properties": {
        "pod_1": { "$ref": "#/$defs/pod" },
        "pod_2": { "$ref": "#/$defs/pod" }
      },
      "additionalProperties": { "$ref": "#/$defs/pod" }
    },
    "system_health": {
      "type": "object",
      "required": ["rpi_core", "pod_1_hardware", "errors"],
      "properties": {
        "rpi_core": {
          "type": "object",
          "additionalProperties": {
            "type": ["number", "integer", "boolean"]
          }
        },
        "network": {
          "type": "object",
          "additionalProperties": {
            "type": ["string", "number", "integer", "boolean"]
          }
        },
        "pod_1_hardware": {
          "type": "object",
          "additionalProperties": {
            "type": ["number", "integer", "boolean"]
          }
        },
        "application": {
          "type": "object",
          "properties": {
            "service_manager": {
              "type": "string",
              "enum": ["none", "systemd"]
            },
            "process_running": { "type": "boolean" }
          },
          "allOf": [
            {
              "if": {
                "required": ["service_manager"],
                "properties": { "service_manager": { "const": "none" } }
              },
              "then": {
                "required": ["process_running"],
                "not": {
                  "anyOf": [
                    { "required": ["systemd_service_name"] },
                    { "required": ["systemd_available"] },
                    { "required": ["systemd_active_state"] },
                    { "required": ["systemd_service_active"] },
                    { "required": ["systemd_sub_state"] },
                    { "required": ["systemd_main_pid"] }
                  ]
                }
              }
            }
          ],
          "additionalProperties": {
            "type": ["string", "number", "integer", "boolean"]
          }
        },
        "spool": {
          "type": "object",
          "additionalProperties": {
            "type": ["string", "number", "integer", "boolean", "null"]
          }
        },
        "watchdog": {
          "type": "object",
          "additionalProperties": {
            "type": ["string", "number", "integer", "boolean", "null"]
          }
        },
        "aggregate": { "$ref": "#/$defs/edgeHealth" },
        "indicator": { "$ref": "#/$defs/indicatorHealth" },
        "errors": {
          "type": "array",
          "items": { "$ref": "#/$defs/error" }
        }
      },
      "additionalProperties": true
    }
  },
  "additionalProperties": true,
  "$defs": {
    "utcTimestamp": {
      "type": "string",
      "pattern": "^[0-9]{4}-[0-9]{2}-[0-9]{2}T[0-9]{2}:[0-9]{2}:[0-9]{2}Z$"
    },
    "pod": {
      "type": "object",
      "required": ["enabled", "metrics", "errors"],
      "properties": {
        "enabled": { "type": "boolean" },
        "metrics": {
          "type": "object",
          "additionalProperties": { "type": "number" }
        },
        "errors": {
          "type": "array",
          "items": { "$ref": "#/$defs/error" }
        }
      },
      "additionalProperties": true
    },
    "edgeHealth": {
      "type": "object",
      "required": ["schema_version", "state", "reasons"],
      "properties": {
        "schema_version": { "const": "senior-pomidor.edge.health.v1" },
        "state": { "enum": ["STARTUP", "OK", "BACKLOG", "DEGRADED", "MAINTENANCE", "CRITICAL"] },
        "reasons": {
          "type": "array",
          "items": { "type": "string", "minLength": 1 },
          "uniqueItems": true
        }
      },
      "additionalProperties": false
    },
    "indicatorHealth": {
      "type": "object",
      "required": ["enabled", "backend", "requested_state", "last_rendered_state", "operational", "last_error"],
      "properties": {
        "enabled": { "type": "boolean" },
        "backend": { "enum": ["mock", "gpio"] },
        "requested_state": { "enum": ["STARTUP", "OK", "BACKLOG", "DEGRADED", "MAINTENANCE", "CRITICAL"] },
        "last_rendered_state": {
          "type": ["string", "null"],
          "enum": [null, "STARTUP", "OK", "BACKLOG", "DEGRADED", "MAINTENANCE", "CRITICAL"]
        },
        "operational": { "type": "boolean" },
        "last_error": { "type": ["string", "null"] }
      },
      "additionalProperties": false
    },
    "error": {
      "type": "object",
      "required": ["sensor", "message"],
      "properties": {
        "sensor": { "type": "string" },
        "message": { "type": "string" }
      },
      "additionalProperties": true
    }
  }
}
