{
  "schema_version": "senior-pomidor.edge.telemetry.v2",
  "device_id": "balcony-edge-01",
  "record_id": "ac1ea799-40b2-4edc-ad02-e4b5cb95a391",
  "boot_id": "6d2aabfe-f77b-4f4e-a362-883b9509d67e",
  "sequence": 1842,
  "timestamp_utc": "2026-06-06T10:00:00Z",
  "stored_at_utc": "2026-06-06T10:00:01Z",
  "pods": {
    "pod_1": {
      "enabled": true,
      "metrics": {
        "adc_raw": 12450.0,
        "soil_moisture_percent": 45.0,
        "soil_temperature_c": 22.4,
        "air_temperature_c": 24.5,
        "air_humidity_percent": 58.2,
        "air_pressure_hpa": 1008.3,
        "air_saturation_vapor_pressure_kpa": 3.07,
        "air_actual_vapor_pressure_kpa": 1.79,
        "air_vpd_kpa": 1.29,
        "light_lux": 18000.0,
        "ir_ambient_temp_c": 24.8,
        "leaf_temp_c": 25.1,
        "leaf_saturation_vapor_pressure_kpa": 3.19,
        "leaf_vpd_kpa": 1.4
      },
      "errors": []
    },
    "pod_2": {
      "enabled": false,
      "metrics": {},
      "errors": []
    }
  },
  "system_health": {
    "rpi_core": {
      "cpu_temp_c": 56.4,
      "wifi_rssi_dbm": -68.0,
      "filesystem_read_only": false,
      "recent_io_error_count": 0,
      "under_voltage_now": false,
      "frequency_capped_now": false,
      "throttled_now": false,
      "telemetry_buffer_file_count": 7,
      "disk_free_bytes": 123456
    },
    "network": {
      "wifi_connected": true,
      "interface_up": true,
      "ssid": "example-wifi",
      "ip_address": "192.0.2.42",
      "default_gateway_reachable": true,
      "dns_resolution_ok": true,
      "internet_reachable": true,
      "wifi_profile_count": 1,
      "active_profile_present": true,
      "preferred_profile_present": true,
      "last_recovery_exit_code": 0
    },
    "watchdog": {
      "state": "healthy",
      "result": "healthy",
      "suppression": false,
      "attempt_count": 1,
      "restart_count": 1,
      "reboot_count": 0,
      "last_healthy_heartbeat_at_utc": "2026-06-06T10:00:01Z"
    },
    "application": {
      "service_manager": "none",
      "process_running": true,
      "process_uptime_seconds": 3600,
      "process_memory_rss_bytes": 123456,
      "process_cpu_percent": 1.2
    },
    "spool": {
      "status": "OK",
      "disk_status": "OK",
      "pending_count": 0,
      "backlog_count": 0
    },
    "aggregate": {
      "schema_version": "senior-pomidor.edge.health.v1",
      "state": "OK",
      "reasons": []
    },
    "indicator": {
      "enabled": false,
      "backend": "mock",
      "requested_state": "OK",
      "last_rendered_state": null,
      "operational": false,
      "last_error": null
    },
    "pod_1_hardware": {
      "bus_voltage_v": 3.25,
      "bus_current_ma": 12.4
    },
    "errors": []
  }
}
